id,regija,podregija,barva,alkohol,zamasek,opis,popularnost
106221,Rhone,Chateauneuf du Pape,Red,14.5,Cork,"The cuvée Vieilles Vignes is from 60-110+ year old vines of Grenache, Mourvedre, Syrah along with smaller percentages of other permitted varieties that are grown in these old vineyards. The wine is sourced from 4 terroirs: pebbly clay, sand, gravelly red clay and sandy limestone.<BR><BR>Over the last quarter century, Domaine de la Janasse has become one of the most highly-regarded estates in Châteauneuf-du-Pape. Led by siblings Christophe and Isabelle Sabon, the estate combines the best of both traditional and modern techniques to craft a collection of truly riveting wines from “simple” value-priced VDP’s to their benchmark Châteauneufs. The estate was founded in 1976 by Aimé Sabon, the father of Christophe and Isabelle, who still oversees the vineyards. The property consists of 40 hectares, spread over as many as 70 different parcels throughout the appellation. The terroirs range from sandy soils, as can be found in their well-known plots in the North of the appellation – Chapouin and La Janasse– to lightly-colored clay limestone soils and gravelly red clay and galets, most notable in their plots in Le Crau in the South. While Aimé works the vineyards organically, his children, Christophe and Isabelle, arxe in charge of wine production. Christophe is a self-proclaimed “great defender of Grenache,” which still represents 75% of their vines. With assistance from Aimé’s farming and Isabelle efforts in the cellar, he harnesses the typical exuberance of Grenache-based wines through careful vinifications that respect both terroir and vintage The results are a wide range of rich and flavorful Châteauneuf-du-Papes, Côtes-du-Rhônes and Vins de Pays that are complex and balanced – often in contradiction to an region better known for sheer size and power. In attempting to describe the wines at Janasse one is confronted with the inadequacies in using “style” to express their qualities. While there is a modern facet to the richness of the fruit, it is beautifully paired with a pronounced sense of place and complexity. The reds are not entirely destemmed and see long and gentle macerations lasting up to a month, which may account for some of the earthiness and finesse in the wines. Aging takes place in various vessels from large concrete tanks to foudres, and demi-muids. The barrels are mostly neutral and darkened with age and repeated use. The Châteauneuf-du-Pape Blancs here are frequently overlooked and are some of the best examples in the appellation. Coming mainly from sandier soils, only the Roussanne sees time in barrel while the Grenache and Clairette are age entirely in tank. Minuscule quantities of a reserve Blanc, the Prestige, is aged entirely in demi-muid from 1-3 years old. The reds from Janasse are frequently considered to be among the best in the region whether it is their pleasingly complex Côtes-du-Rhone and Côtes-du-Rhône Villages or their three bottlings of Châteauneuf-du-Pape. Not surprisingly the aptly named Tradition is the most reserved of their Châteauneufs while Chaupin and Vieilles Vignes are studies in contrast, between the purity of Grenache from sandy soil clearly evident in the former, to the intensity and power of the later – an indication of the age of the vines, the range of soils from which they are sourced and the density afforded by the addition of old-vine Syrah and Mourvedre to their centenary Grenache."" -Importer",88
112886,California,Mendocino,White,14.2,Screwtop,"This wine displays aromas of vanilla creme brulee, honey roasted pears and juicy pineapple. These follow through to the palate along with a hint of spice, tropical fruits and dried apricots. The oak is very subtle, the texture is silky and the finish is bright. A very balanced expression of this varietal that can be enjoyed on its own, but also pair nicely with your favorite salad or seafood dish.",828
120013,California,Napa,Red,14.0,Cork,"A very balanced Cabernet from this iconic winery located in the Diamond district. The wine offers lots of dark berries and ripe fruit on the nose, yet maintaining brightness and a very expressive profile. On the palate is full body with velvety tannins and  a clean long finish.",982
117581,California,Napa,Red,14.8,Cork,"It’s all about bringing out that unique varietal character, in our reds it’s about  ripe almost chewy tannins and bold aromatics and botanical notes bringing the perfect amount of spice and texture to enhance the whole drinking experience. As for our white wines we seek power, finesse, concentration, precision, energy, and satisfying aromatics. In respect to all Edict wines, you can age them for many years but with the right pairing you can enjoy them right now.""
-Winery

",594
119824,Bordeaux,Bordeaux Superior,Red,13.5,Cork,,67
120087,South Island,Marlborough,White,13.0,Screwtop,"100% of the fruit for this wine is sourced from the Redwood Hills, Awatere Valley. The fruit for this wine was grown on the lower and middle slopes of the hill. These naturally low cropping blocks produce wines with great concentration and purity.
The fruit was harvested in the cool of the morning and transferred to the winery where it underwent temperature-controlled fermentation in stainless steel tanks using carefully selected yeast cultures. The winemaking was straight forward, as the exceptional vintage required very little intervention.""
-Importer",717
117884,California,Monterey,White,,Screwtop,"Fresh fajitas. Relaxing before dinner. A night out for Thai or Vietnamese. Conundrum White goes with them all. Sourced from California’s premier winegrowing regions, this wine is both exotic and bright, a blend of Chardonnay, Sauvignon Blanc, Semillon, Muscat Canelli and Viognier. It lures you in with scents of apricot, pear and honeysuckle, and if you’re paying attention, orange and lemon meringue pie. Initial sweetness is balanced by natural acidity, and we love the hint of oak that plays with flavors of peach, apple and citrus. The long finish will leave you longing for another glass."" - Winery",347
10129,Italy,Italy,White,5.5,Screwtop,"VERDI is a totally new spumante both in its formula and its presentation.
Slightly sparkling, low in alcohol (5%), delicately sweet, with a great bouquet.'"" -Winery",652
118861,California,Napa,White,,Cork,"A single vineyard Napa Chardonnay from the foot of Howell Mountain that exudes quality and character! Terrific gooseberry, lime, lemon, grapefruit and herbal tones drive this absolutely sensational wine. This is perfect for a quick glass of wine before dinner or to pair with citrusy seafood or salads. Even try this with sushi! If you're a fan of big time New Zealand labels like Kim Crawford and Matua or into class CA Sauv Blancs like Duckhorn or Merry Edwards you will find so much to love here! ",202
114944,Mendoza,Lujan de Cuyo,Red,14.1,Cork,"Deep red color with violet and blue tones. Aromas of white flowers and black fruits along with notes of white pepper and cloves. Elegant and balanced, presents hints of licorice and chocolate. Broad and smooth with firm tannins that lead to a persistent finish."" - Importer",486
114450,Rhone,Cotes du Rhone Villages,Red,14.0,Cork,"Warm red fruit with soft tannins, good acidity. Dark fruit, black cherry, smooth tannins and some spice.",890
119746,Oregon,Willamette Valley,Red,14.0,Cork,"COLOR: Perfect Pinot-esque color with ruby red interior followed by light lilac edges. This is what color and transparency Pinot noir should be. The wine pours beautifully into the glass and nothing will embarrass you in front of the “Burgundy is Better” crowd plus it will teach a thing or two to those who are drinking adulterated Pinot noir from Baja, Oregon.  No blending of other varieties or any use of enzymes here to extract deeper and darker colors to fool you into thinking the wine is bigger than it might be. This is real wine and it will make you and everyone else really happy. AROMATICS: When opened four days ago, or rather FIVE days ago, the aromatics were shy and just showing a nice clean, cherry and plum aroma with a hint of summer dustiness. Over the next few days the wine evolved and a range of aromas showed through with fruit and earth combining on the third day: muddled cherries, alfalfa, roasted plums and morel mushrooms. Now, on the evening of the FIFTH DAY all aromas are all there: starting with violets, freshly sliced black plums, peach skin, orange pith and almond butter. Give the glass a big swirl and then wait… wait for another minute… THEN go back to the glass and inhale: wild strawberries! Rarely do I ever get strawberries in my Pinots but it is here in this one! Amazing aromatics. You could spend an inordinate amount of time just breathing in this wine as it is always changing, albeit slowly, it is changing and evolving, because it is real wine. FLAVORS: Once imbibed an explosion of blueberries with freshly squeezed lemon are obvious. A smooth, mouth enveloping wash shows more French Green Plum Tart followed by a raison cinnamon bagel toasted to the brown perfection where the raisons are starting to caramelize. Think perfectly aged Barolo without the aggressiveness. How did this happen? Step away for a while then come back to experience smashed raspberries with diced kumquat. How weirdly satisfying is that combination? Have a bit more patience and experience blackberries, wild plums, sous bois (forest floor) and then caramelized plums, dusty raspberries, salmon berries, black currants soaked in Marc tossed over ripe Epoisses cheese and spread over a crusty baguette.  This is living!"" - Winery",30
116494,California,Lake,Red,12.9,Cork,"The “Village Series” from Folk Tree is a project that started with you, the consumer. Ever more people are looking for value, good quality wines that were not “manufactured” but grown.  Enter Village Series! Sustainably farmed from Santa Barbara Highlands & Arroyo Grande both up & coming regions for great Pinot Noir. Aged for 8 months in French oak w/ partial malolactic fermentation retaining great natural acidity while offering riper and richer fruit. Beautiful notes of cherry and raspberry fruit w/ brilliant acidity and a kiss of toasty oak and spice. Clean, fresh and super drinkable. This is wine for the people made by the people!",193
117901,California,Sonoma,White,,Screwtop,"One of the first two wines Ferrari‐Carano ever made over 35 years ago, this Fumé Blanc is comprised of Sauvignon Blanc grapes from Sonoma County. This wine has delicious aromas and flavors of pineapple, pink grapefruit, lemongrass, lychee, peach, pear, honeydew melon, orange blossom, guava and a touch of minerality. The Fumé Blanc has bright acidity and crisp freshness from the cool, stainless steel tank fermentation, while the subtle oak character from neutral French oak barrels adds body, complexity and depth."" - Winery",310
92487,Emilia-Romagna,Lambrusco Grasbarossa Castelve,Red,12.0,Cork,"Red impenetrable load and creamy foam. On the nose they perceive hints of blackberry and ripe plum. The mouth is full of sweetly winy nectar, with a finish with velvety tannins, which seduces and surprises for the big cleaning and balance. Back in the memory of those who have the good fortune to taste."" -Winery",740
118630,Abruzzi,Montepulciano d&#39;Abruzzo,Rose,12.5,Cork,"Campirosa (literally 'Pink Fields') is a tasty rose made with 100% Montepulciano grapes.  Montepulciano is the main red grape variety of the region and its rose version is called Cerasuolo (meaning 'cherry' in Italian) because of its attractive cherry-like color.  Pretty floral and berry aromas follow through to the palate. Dry and fresh with a good finish. Served well chilled it will pair beautifully with appetizers, seafood dishes, grilled vegetables and grilled poultry."" - Importer",255
113497,Bordeaux,Bordeaux Superior,Red,14.5,Cork," “This ripe wine is full of black fruits and ripe tannins, suggesting a fine future. It’s structured and dense, which promises richness as it develops and opens up. Give this concentrated wine until 2022.” - Winery",605
104168,Piedmont,Asti,White,10.0,Cork,"Bartenura Demi-Sec is limited edition sparkling white wine that is delightfully refreshing and refined, featuring aromas of ripe peaches, melons and toast with a gentle sweetness. Flavors are highlighted with notes of honey, tangerine and pears. The lingering finish is creamy and well balanced with a touch of acidity.-- Importer",941
116465,California,Sonoma,Red,13.5,Cork,"Aromas of cassis, black plum, and ripe Bing cherry, with a touch of toasty oak. Complex notes of cocoa, cassis, pepper, and cedar. Black fruit dominates the entry followed by plum and black cherry with a spicy, lifted mid-palate. A bit of peppery cassis leads the finish with some roasted coffee notes and supple yet firm tannins.
<br>
-- Winery",412
117893,California,Sonoma,White,14.1,Cork,"On the nose this wine reveals oak toast, nectarine and ripe pear aromas. The palate is endowed with integrated oak structure, hints of vanilla cream, lemon zest, and baked apples. Building momentum across the palate, this wine’s finish is formative with lingering flavors of spice and crème brûlée."" - Winery",557
116683,California,Central Coast,Red,14.2,Cork,"Bold Wine Co. has been a winery that seems to be extremely popular. So we are excited to bring you their single vineyard, Santa Lucia HIghlands Pinot Noir. All the grapes are sourced from the Paraiso Vineyard, most known for being the first plantings of Pinot Noir in all of Santa Lucia. This is a classic California Pinot Noir with the body of Burgundy. Lots of bright fruits upfront, but the lower abv and high acidity are more similar to an Old World wine. It is aged in neutral barrels, so there isn't a significant amount of oak influence on the wine. Really great juice at an insanely reasonable price. ""Dried blueberries, plums of every color, roasted bing cherries, and a soy-umami savory character."" - Winery",107
117943,California,California,Red,14.5,Cork,"Heady scents of ripe summer strawberries make a lovely first impression, while hints of crushed violets and sweet dried herbs resonate on the nose. Refined and nuanced, the mouthfeel softens as layers of cherry fruit are wrapped in a comforting blanket of pipe tobacco and worn leather. The firm, yet lingering finish is perfectly balanced with touches of baking spices, fragrant fruit and earth tones."" - Winery",384
119962,Burgundy,Cremant de Bourgogne,White,,Cork,"Not all Crémant de Bourgogne are created equal. Michael and Harmon Skurnik have searched for years for a Crémant de Bourgogne that can deliver the quality and value that the Skurnik name has come to represent. With Victorine de Chastenay, they have found that rare combination. Long an afterthought for many producers in Burgundy, these delicious sparklers come from fruit in the Côtes de Nuits and Côtes De Beaune in Burgundy (a welcome contrast to most Crémant de Bourgognes that are made from fruit in the Mâconnais, Beaujolais, and Côte Chalonnaise). From the complex and refreshing Brut Blanc to the 100% Pinot Noir Brut Rosé, these wines are made completely in tank to preserve the minerality and freshness of the Côte d’Or fruit and are aged on the lees for 20 months before release (the minimum for the appellation is 12 months!). It is rare to find Crémants of such pedigree and quality at a value price and we couldn’t be more thrilled to have you try them."" - Importer",691
118229,California,Napa,White,14.1,Screwtop,"Pale lemon in color, this Sauvignon Blanc has great intensity on the nose with gooseberry, fresh cut grass, juicy mango, lemon rind, and grapefruit. This wine is dry with crisp acidity and a palate that unveils layers of pineapple, lemon, lime, minerality, and rich creaminess through the mid-palate developed by stirring the lees in tank."" -Winery",445
119293,Piedmont,Carema,Red,,Cork,"This exceptional and rare wine is produced only in the finest vintages. It comes from a special selection of grapes harvested from several particularly well-placed parcels within the appellation (frequently from the Silanc and Siei vineyard sites). Aged for at least three years prior to bottling, the “elevage” is done primarily in small barrels, only a small percentage of which are new. One hundred of the three hundred cases produced are dedicated to the US market, augmented by a small amount of magnums."" - Importer",916
119143,Loire,Touraine,White,12.0,Cork,"Always a dry wine, this Sauvignon has a powerful fragrance, harmonizing the riches of the Loire Valley with a delicate hint of muscatel. Crisp and fresh, connoisseurs will recognize the classic “gunflint “ taste distinctive to the region. Enjoy with shellfish, grilled fish, or by itself!",853
119823,Argentina,Argentina,Red,13.5,Cork,"While Argentina is most known for making Malbecs, they do grow other grapes and they make a wide range of wines.  This is a classic red blend of Cabernet Sauvignon and Malbec that is rich in both fruit and earth flavor profiles. ",150
113220,Cava,Cava,White,11.0,Cork,"TRUE COLOURS is a cava from the region of Penedes, Spain with grapes selected from the varieties Macabeo, XAREL.LO and Parellada, and a touch of Chardonnay. It has a aging process of 14 months and you will enjoy the bright, crisp & dry finish."" - Importer",500
30658,Cava,Cava,Rose,12.0,Cork,,629
118256,Niederosterreich-Lower Austria,Kremstal,White,12.5,Crown Cap,"For the “Getränk,” the folks at Dürnberg in the village of Falkenstein are using younger vines at higher altitudes.  Approximately two-thirds of the grapes come from Dürnberg vineyards, with the remaining from two growers in the same village who closely follow the same rules of certified sustainable farming. Harvest can take place quite late, beginning in the end of September, which is a big advantage. The grapes preserve well-balanced natural acidity, and are collected and processed at cool internal temperatures, helping to avoid oxidation and any disagreeable aromas or flavors. Fermentation is done in temperature-controlled steel tanks, after which the wine rests for two months on the lees, followed by filtration and bottling.  The result is an easy-drinking, refreshing glass of wine.  Crisp, dry and ultimately gulpable. Green apple, grapefruit and white pepper notes lead to a refreshing finish.
<br>
-- Importer",783
115828,Oregon,Willamette Valley,White,13.0,Screwtop,"The 2018 A to Z Chardonnay greets with aromas of lemon, lime zest, kumquat, quince, spiced apple, pear, peach, melon, apricot and lemongrass with hints of sage and fresh cut hay.  The wine dances on the palate, alive with flavors of citrus fruits, green apple and starfruit.  It is rich and yet balanced, fleshy and yet precise.  There is a grapefruit pith note to the finish, along with a linear minerality that carries through for quite some time after tasting. The 2018 A to Z Oregon Chardonnay is a racy, delicious example of unoaked cool-climate Chardonnay! "" - Winery",279
119519,South Island,Marlborough,White,,Screwtop,"Displays a complex nose with aromas of tropical fruit, herbaceous notes and a hint of cassis. The natural fermentation adds a rich and textural quality to the palate, with subtle notes of lemon zest and passion fruit. The finish is crisp and dry. Delicious with all types of seafood and summer salads, or enjoy by itself as a refreshing aperitif. ",296
118618,Greece,Macedonia,Rose,12.5,Screwtop,"The color is bright, light cerise with pink hues. Vibrant and clear on the nose, with aromas of ripe cherries, raspberries, hints of flowers, and rose petal notes. On the palate it has a medium body, moderately high acidity and the slightest suggestion of very ripe tannins. Flavors are consistent with the aromas. The finish is moderately long, with developing flavors that lead to complexity.",900
117114,Portugal,Dao,Red,13.0,Cork,"The Quinta de Cabriz Dao is a blend of the indigenous varieties Tinta Roriz (known as Tempranillo in Spain), Touriga Nacional and Alfrocheiro and is aged in French oak. This deeply-colored red wine is medium-to-full-bodied, a bit lighter than wines from the Douro, with impressive concentration of flavor.<br>
<br>
As Wine Spectator notes, Cabriz consistently excels in the under-$20 range.<br>
<br>
Simply put one of the best values under $10.00 a wine to buy by the case.",453
118945,Trentino-Alto Adige,Alto Adige,White,12.0,Cork,"With its straw yellow color, clean intense aroma, and dry golden apple taste, our signature Pinot Grigio is full of authentic, flavorful personality."" - Winery",516
117829,California,California,White,14.1,Screwtop,"“Our North Coast Chardonnay was primarily sourced from Mendocino County, Lake County and Solano County.  Attentive canopy management ensured optimum fruit quality during harvest. In this vintage we see exceptional fruit-driven characteristics combined with brilliant acidity, making this wine an ideal food-pairing partner.<BR><BR>Our William Hill Estate North Coast Chardonnay is medium-bodied and food-friendly, featuring ripe notes of honeydew melon, juicy pear and apple crumble. Backed by delicate hints of meyer lemon and nutmeg, this elegantly structured Chardonnay is smooth and well-balanced, with crisp acidity and a creamy mouthfeel.” -Winemaker Note",146
114311,Rheingau,Rheingau,White,11.5,Screwtop,"Eva Fricke was born in a small village in Lower Saxony the daughter of two doctors. Her passion for wine originated during a practical training in the vineyards of South Africa. Upon returning to Germany, Eva studied viticulture and oenology in Geisenheim, where she graduated in 2001. During her studies, she worked at several vineyards around the world including Château Cissac in Hâut-Médoc; Schloss Johannisberg in the Rheingau; Castello di Verduno in Piemont; Dominio de Pingus in Ribera del Duero in Spain; and Pepper Tree in Hunter Valley in Australia. The Eva Fricke Mellifluous is from holdings in Kiedrich, Walluf and Frauenstein on loess clay, slate and quarzite soils.
<br>
-- Importer",845
81495,Champagne,Champagne,Rose,12.5,Cork,,795
116882,Greece,Macedonia,White,12.5,Cork,"100% Malagouzia, an ancient grape varietal producing highly aromatic wines with a round and soft palate. The wines are from P.G.I. Florina in north-west Greece. The grapes are destemmed and fermented in stainless steel under temperature control and aged 2 months on the lees. This wine is produced from estate owned vineyards at 690 m elevation on northwest facing vineyards."" - Importer",280
108578,South Island,Central Otago,Red,13.5,Screwtop,,957
108994,Piedmont,Moscato d\&#39;Asti,White,9.0,Screwtop,"Bright golden yellow, a fine and delicate perlage. Notes of exotic fruits and orange zest, peach and apricot. Sweet with subtle aromatic aromas of citrus fruit; the aromatic aftertaste recalls the flavour of the Moscato grape, with pleasant freshness."" - Winery",812
119687,Mendoza,Mendoza,Red,14.1,Cork,"An authentic Argentine wine that thrives in Mendoza’s high altitudes, our Alamos Argentinian Malbec wine blends the deeply concentrated plum flavors of the country’s signature variety–Malbec–with small portions of Syrah and Bonarda to add dark cherry and blackberry flavors. Well-integrated hints of brown spice and vanilla contribute layers of complexity. A full structure, firm tannins and a long finish create an expansive palate that is hard to forget. With crisp, clean air and intense sunlight, growing conditions in Mendoza are truly ideal for Argentinian Malbec.
<br>
-- Winemaker's Note",111
118127,Roussillon,Cotes du Roussillon,Rose,12.0,Screwtop,"Luscious, aromatic nose of raspberries and strawberries. Fresh in the mouth with a well -balanced, full and lively middle palate, and a spicy, lingering finish. Drink anytime as an aperitif or with seafood, poultry, grilled meats, barbecue and Mediterranean-style cuisine."" -Importer",541
118310,Tuscany,Brunello di Montalcino,Red,14.0,Cork,,2
115232,Portugal,Douro,Red,13.5,Cork,"Grapes exclusively from the Quinta de Ventozelo, Established in the 16th century. Fermentation with strict temperature control in order to maximize the aromas of the grapes and produce a wine with a fresh and long palate. The wine aged in 500lts French oak barrels and revelas intense flavors, with aromas of mature red fruits and spicy notes combining into an attractive and long finish.",392
113596,Friuli-Venezia Giulia,Colli Orientali del Friuli,White,12.5,Cork,"Pinot Grigio is perhaps one of the most quintessentially Italian grape varieties and north-eastern Italy is the epicenter of its production. In Friuli, PG has been cultivated since the first half of the 19th Century where it found perfect growing conditions in the Colli Orientali marly terrain.

Poggiobello Pinot Grigio is as good as Pinot Grigio gets: there is a variety of elegant fruit and floral notes on the nose. It is well-structured and full-bodied on the palate with a fruity finish. Because of its medium-to-full bodied style and vibrant acidity it will pair well with rich seafood dishes, but also with pasta Bolognese, eggplant parmigiana, pasta alla Norma (with eggplant and ricotta cheese) and cold-cuts like culatello from Emilia or Tuscan finocchiona."" - Importer",668
