id,regija,podregija,barva,alkohol,zamasek,opis,popularnost
114742,Rheingau,Rheingau,White,9.5,Screwtop,"Under the direction of Johannes Leitz, Weingut Josef Leitz has earned the reputation of being one of Rheingau’s top growers and moreover, one of the finest producers in Germany. Since taking over his family estate in 1985, Johannes has grown his holdings from 2.6 hectares to over 40, most of which are Grand Cru sites on the slopes of the Rüdesheimer Berg. Once the home of some of the world’s most sought after and expensive wines, the region fell to mediocrity in the years following the Second World War. Josi has made it his life’s work to reclaim the intrinsic quality of his native terroir and introduce the world to the true potential of the Rheingau. “Lay” is a very old word meaning slate and ""Kloster"" is the German translation of Abbey. The slate found here is ancient—predating the Devonian period—and similar to the crumbly, soft grey slate found in the Rottland. Josi believes this site is destined for a fruity style and therefore always makes Kabinett from this vineyard. Clear and precise on the nose where ripe Riesling flavors intertwine with some earthy mineral tones, the light yet full-flavored palate is surprisingly pure and offers a lingering piquant, racy and elegant Riesling Kabinett full of terrior-driven character and finesse. This is a lovely stimulating, salivating Kabinett.
<br>
-- Importer",1636
118043,California,Napa,White,13.5,Cork,,1909
115158,Oregon,Willamette Valley,White,13.0,Cork,"Illahe pinot gris is layered with complex fruit and starts with notes of crisp granny smith apple, bright lemon zest, and hints of clove, paired with light notes of papaya and starfruit. Part of the fruit from the 2018 pinot gris is from our estate vineyard and part is from our neighbors at Erratic Oaks Vineyard. Both sites are heavily influenced by the Mount Pisgah weather patterns and soil structures. It is also influenced by the neutral oak it is vinified in, which adds creaminess and texture with lingering flavors of almond butter and a spicy finish of cardamom creates an exciting and flavorful wine that is sure to leave you wanting more.""-Winery",1724
112633,Burgundy,Nuits Ste Georges,Red,13.5,Cork,"Domaine Michel Noëllat & Fils one of the legendary names of Vosne Romanee, sits just away from the Mairie of Vosne-Romanée in Rue de la Fontaine, its close neighbour is Domaine Leroy. Hardly the most famous name in the village, yet this Domaine extends to 27 hectares, covering some of the most sought after vines in all of Burgundy. Yet these wines purposely fly under the radar as they remain relatively unknown outside of France, mainly because only about 10% of the domaine’s production is exported and 5% to the USA."" -Importer",1374
118494,California,Sonoma,Red,13.9,Cork,"The 2015 Cabernet Sauvignon embodies our cool climate hillside vineyard. Elegant and well balanced with elongated tannins and complex layers of forest floor, graphite, sage, and dark fruit. Drinking beautifully now, and will continue to age gracefully for decades to come."" - Winery",1661
113838,California,California,Red,14.5,Cork,"On the nose, there are hints of chocolate, sugar plum, raspberry & incense. On the palate, there are flavors of fruit cake, blueberry & cherry. This wine would pair best with a spiced pork tenderloin in a cherry-thyme sauce.",1231
16213,Madeira,Madeira,White,18.0,Cork,,1118
111813,Rhone,Chateauneuf du Pape,Red,14.5,Cork,,1548
114251,Campania,Fiano di Avellino (Apianum),White,13.0,Cork,"Medium intensity yellow with golden reflex. With a strong and persistent character and a hint of Renette apples, broom flowers, citrus fruits, rock.
Tasty, harmonious, delicate, enfolding and enduring.
Recommended with fish. Excellent as an appetizer.",1698
114869,Piedmont,Barbaresco,Red,14.5,Cork,"From the Winemakers' Website: This classic Barbaresco is a blend of our finest vineyards, a small part of Asili, the part with younger vineyards, & the lowest part of Bernadot in Treiso. With the union of these two different expressions, the wine achieves a better balance than vinifying the two wines as separate parcels. While on the one side there is the explosive finesse of Asili & on the other, the fullness of the Treiso cru, in the glass we find the right balance; the result is a delicious & traditional wine, a perfect example of an area that moves between structure & elegance.",1362
118710,South Australia,Barossa Valley,Red,14.5,Screwtop,"The nose shows lifted boysenberry, ﬂorals and hints of anise and clove. The palate is awash with fresh, vibrant blueberries and concentrated plums with hints of cedar spice ﬁnishing with ﬂowing waves of extremely ﬁne tannins."" -Importer",1732
116074,Israel,Upper Gallilee,Red,15.0,Cork,"Mevushal. Shiloh Secret Reserve Cabernet Sauvignon 2016 is a luxurious wine a dark red color and aromas of black fruit and cassis. It's a smooth wine, full of flavor and notes of fruit. It's rich bouquet of tobacco and coffee make for a delightful long finish.",1227
114887,Rhone,Chateauneuf du Pape,Red,14.5,Cork,,1677
117306,Hungary,Tokaji,White,10.0,Cork,"This wine is concentrated with big structure, elegant and graceful with a nose of orange peel mixed with honey. Lively acidity provides backbone and balance with intense richness and depth. Superb now with the promise of great longevity. A true volcanic wine.
<br>
-- Distributor",1948
115618,Oregon,Willamette Valley,White,11.2,Cork,,1765
115992,Burgundy,Burgundy,Red,12.5,Cork,"Elegant and nuanced entry-level Burgundy with notes of crasined cherry, dried forest berry, bramble and rose petal. Drink now.",1335
119552,South Island,Marlborough,White,13.5,Screwtop,Sunday Mountain is a beautiful picnic spot near Blenheim in Marlborough overlooking idyllic vineyards. This Sauvignon Blanc is a perfect balance between the traditional gooseberry characteristic and tropical fruit flavors that come from specific position in the Marlborough region.,1620
113740,California,Napa,Red,15.3,Cork,,1270
114448,California,Lodi,White,13.0,Screwtop,"A vibrant Sauvignon Blanc with a dash of pink-grapefruit and citrus-lime notes that are softened by a hint of pineapple-guava character in both the aroma and flavor. As a fruit forward wine with balanced acidity and a smooth texture, our 2018 vintage is bright and refreshing."" - Winery",1159
114870,Piedmont,Barolo,Red,14.5,Cork,,1509
119373,Burgundy,Burgundy,White,13.5,Cork,"2000 bottles per vintage. White Burgundy is on the rise. Coming from Chardonnay, it highlights this grape variety which has become universal and which here has its cradle and its most perfect expression. Chardonnay (49% of the Burgundy grape variety), born in Burgundy, gives pretty golden bunches, small and elongated. Its grains are small and rich in a deliciously sweet white juice. The name of the cuvée ?! The name of our gambling den… (hush!)""- Winery",1294
117840,Portugal,Dao,Rose,12.0,Cork,"This delicate and lively rose captures the essence of the Dao's indigenous grape variety. Balanced and intriguing, with layers of fresh forest fruits and lifting acidity drawn from our granite mountain soil. One of best Values in the World of Rose for Taste and Quality in this Price range. ",1781
112021,Port,Tawny,Red,20.0,Cork,,1502
116019,Piedmont,Langhe,Red,14.0,Cork,"This is a 100% Nebbiolo sourced 100% from the Alba appellation in Piedmont. This is what we call in the industry, ""Baby Barolo."" The wine is young and vibrant with lots of fresh berry notes, leather, and a little anise. It spends 12 months in oak before release, so there is a level of vanilla and baking spice on the back end. This is the kind of Nebbiolo you want to open up now and enjoy right away. There is some time for it to age in the cellar, but it is really great right now! Refined and woven together with delicious tones of cardamom spice, cedar wood, refined tart cherry and a touch of balsamic on the finish. A great effort!

",1152
118902,Burgundy,Rully,Red,,Cork,"There are few other artisans in the Côte Chalonnaise that faithfully craft Burgundy with as much purity, elegance or character as does Vincent Dureuil. Not only is Dureuil a gifted winemaker, but also he is blessed with some exemplary older-vine vineyards that have for years been cared for organically—another level of attention that sets Dureuil apart from the rest. His delicate touch translates each individual terroir into a perfect liquid picture of what the best of Rully—and the best of Burgundy, for that matter—can be. For fans of Côte de Beaune reds, this Rully will impress (and spare your pocketbook, too). Savory red fruits, delicate spice, deliciously long. One of our favorite, go-to Bourgogne Pinot Noirs every vintage. Aromas of black cherry jam, cinnamon, pepper. Balanced and fresh; red stone fruits, baking spices."" -Importer

",1851
119898,Champagne,Champagne,White,13.5,Cork,"Key to the fantastic complexity of the Bérêche Champagnes are the number of different terroirs that make up the estate’s holdings. Their holdings can be found, for example, in Ludes, on the chalky Montagne de Reims; in Ormes, in the Petite Montagne de Reims; and Mareuil le Port, in the western Vallée de la Marne.

These are augmented by small plots in Trépail on the eastern slope of the Montagne de Reims and, from 2012, the estate’s first grand cru site, a tiny parcel in Mailly. And, apart from the Brut Réserve, Raphaël and Vincent experiment tirelessly with the character of these very different terroirs, creating a range of cuvées prized for their originality.""
-Importer",1914
21572,California,California,Red,0.2,Screwtop,"Fre Red Blend offers a deep ruby color and ripe, black cherry scented aromas. Smooth and rich, it offers plenty of bright, grape, and cherry fruit with an intriguing smoky flavor. Fre Red Blend ends with a long, fruity, lingering finish. This alcohol removed wine is delightful on its own or paired with salmon, turkey, chicken and ham dishes, as well as pasta, pizza, and grilled meats."" - Winery",1447
114325,Alsace,Alsace,Red,12.5,Cork,"Made from the famous grape variety of Burgundy, this agreeable red wine presents a distinctive Alsace character. Supple, with intense fruit, it can be drunk with charcuterie, red meat and cheese."" - Importer",1017
117879,Champagne,Champagne,White,12.0,Cork,"The name of Cuvée 1522 is a tribute to the year when the Philipponnat family settled in the village of Ay, in the heart of the Champagne wine-growing area. The family’s ancestors can be traced back in time through the House archives right back to the first, Apvril le Philipponnat, who from 1522 owned vines in “Le Léon”, between Ay and Dizy. Deep, bright gold in colour. Fine bubbles form a persistent ring. The nose is initially expressive and open, mingling generous notes of warm bread and honey. A superb richness comes through in notes of honey, caramelised mirabelle plums and a hint of vanilla. The finish is tangy, which is typical of this vintage."" - Winery",1739
80552,California,Napa,Red,15.0,Cork,,1693
120278,Trentino-Alto Adige,Alto Adige,White,13.5,Screwtop,An everyday white white that is meant to be chilled down and crisp.  A fresh everyday white wine.,1369
118233,California,Napa,White,14.5,Cork,"Hailing from acclaimed vineyard sites, the 2018 Carneros Chardonnay offers a creamy full body complemented by fresh, persistent acidity. Layers of yellow apple, lemon curd, baked pear, and toasted brioche lead to a balanced and lasting finish of vanilla and baking spice."" -Winery",1386
110143,California,Napa,Red,13.6,Cork,"A brilliant Pinot Noir! Rose, lavender and rosemary aromas spring from the bottle with an alluring and clear first impression of true Pinot form. Layers of ripe strawberry, cranberry, red plum, raspberry and Rainier cherry unfold shortly thereafter and are rounded out by the warmth of cardamom, clove and vanilla spice from time spent resting in elegant French oak. Tasting reveals more of its youth and vigor than its bouquet suggests. Textured fruit flavors of blood orange, cranberry and pomegranate burst through the mid-palate and carry through a long, mouthwatering finish nuanced by Carneros terroir notes of sage and forest floor. A wine to quaff, to contemplate or to complement a meal... this wine is pure pleasure. ",1806
119887,Tuscany,Brunello di Montalcino,Red,14.5,Cork,"Colour: brilliant and intense ruby red.
Bouquet: spicy, hints of pink pepper, wild herbs, plum, blueberry and rhubarb.
Taste: soft and balanced with delicate tannins and vibrant acidity, long persistency."" -Winery",1105
114821,California,Santa Barbara,White,13.5,Cork,"This wine is 100% from our Sta. Rita Hills estate and is a combination of clones 4, 76, and 95, along with Mount Eden, Hanzell, Hudson, Wente and Melville selections. Our chardonnay vines were planted in 1997, predominantly on the west side of our estate where we have several different types of sandy soils. Because the west side receives the brunt of brutal ocean-winds and has only poor soils, we feel our chardonnay always captures the vibrancy, minerality, and concentrated flavors that are hallmarks of our appellation. Fruit was grown and harvested by hand then gently whole-cluster pressed, cold settled overnight and transferred by gravity to barrel for fermentation in neutral French oak barrels (10 to 20 years old), with zero malolactic and sur lie aging without any lees disturbance. Yields were 2.4 lbs/vine (2.2 tons/acre). Pale straw in color, with intriguing aromatics of lemon peel, crushed rocks and minerals coming through initially. On the palate, notes of fresh ginger, kumquat and dried straw mingle with impressions of saline, fresh sourdough and D’Anjou pear. The mouthfeel is vibrant, with a touch of oiliness on the mid-palate along with an energetic streak of acidity that anchors a voluptuous and polished finish."" -Winery",1555
114370,Burgenland,Neusiedlersee,White,10.5,Cork,Sweet sparkling wine that has a lot of similarities to the classic sweet sparkling wines of the Asti in Italy. ,1040
115425,Olifants River,Olifants River,White,13.0,Screwtop,"From the Winemakers' Website: ""The Cederberg style Chenin Blanc offers beautiful layers of melon, grapefruit & fleshy white pear. Four months lees contact ensured a mouth coating creaminess on the palate with a lively crisp acidity to finish off. Altitude vineyards make this Chenin Blanc truly unique. This wine will be well suited to creamy dishes as well as light summer lunches"".",1410
55488,Veneto,Prosecco,White,11.0,Cork,"This bright sparkler, made in Northern Italy from 100% Prosecco is the perfect accompaniment for any occasion. It offers a lively, fruity nose of peaches and nectarines which persist to the palate with soft, creamy citrus accents that finish with a gratifying burst."" -Winery",1943
115272,Georgia,Kakheti,White,12.5,Cork,"Pale gold with greenish highlights. Intense floral and inviting nose with hints of Grapefruit and lemon. Full and weighty to taste with notes of tropical fruits, green apple is lingering to the crisp and zesty finish with fresh and mouthwatering acidity."" - Winery",1685
120003,California,Sonoma,Rose,13.5,Screwtop,"Our 2019 Angels & Cowboys Sonoma County Rosé is crafted using traditional techniques borrowed from the great winemaking domains of Provence in the South of France. This Vin Gris style permits only a very short maceration/contact time between the juice of the grape berries and their skins. In keeping with this delicate style, our grapes are harvested at around 21 degrees Brix- a tipping point where berry flavors are developed, fresh, and light but have not yet matured to a richer, fuller - bodied style. This early flavor profile maturity aligns with a most pleasing acid balance.""
-Winery",1390
114691,California,California,Red,13.5,Cork,"Dark ruby color. Light to medium bodied with aromas and flavors of raspberry, tart cherry, spice with a touch of earth. Supple and balanced with a smooth finish.",1543
116324,Southwest,Jurancon,White,15.0,Cork,"A stunningly interesting effort from an iconic vintage. Aromas of dried nectarines, honey and candied mandarin orange on the nose. Great unctuous texture and an elegant yet never overbearing presence of sweetness. Just divine, and overall, a well-crafted dessert wine that has aged incredibly well.",1113
114248,Aragon,Calatayud,Red,16.0,Cork,,1810
119964,Coastal Region,Stellenbosch,Red,,Cork,"David & Nadia is a family owned Swartland driven project and we focus on a spectrum of organic, old and dry land bush vine vineyards from different areas with different soil types throughout the Swartland, farmed by like-minded people. We are members of the Swartland Independent Producers."" - Winery",1955
116818,Roussillon,Corbieres,Red,14.0,Cork,"This old vine Carignan is the definition of a classic wine from Roussillon, France.  The earthiness is matched with the notes of dried fruit all brought together by the balance between structure and acidity.  This is a food wine that will go with almost anything you can think of.  Truly a spectacular wine! ",1406
117865,Burgundy,Pommard,White,,Cork,"The Hautes Côtes de Beaune Blanc from Denis Carre is a beautiful, everyday white Burgundy (what a treat to finally have enough wine available to actually say this!). Great minerality, lovely lemon and zesty notes, super fine and just a touch of oak to give the wine a weight that simply dances across the tongue.  The excitement over the 2018 vintage in the Côte d'Or is well-known, and it's well warranted. The weather was perfect during the growing season, Mother Nature was kind, and yields were high across the region.  This had vignerons giddy, and wine lovers all over are ready to pounce - after waiting patiently for a robust and idyllic vintage like 2018.   This is one to load up on if you're a fan of the complexity and uniqueness that only White Burgundy can offer.  Carre is a true ""boutique"" style producer, who practices organic farming over his 14 hectares, and does an awesome job of just letting the terroir do the talking in all of his bottlings.  This wine is pristinely clean and sharp - a tremendous effort from an absolute hidden gem in the ""high slopes"".  ",1056
117811,Piedmont,Other Piedmont Red Wine,Red,13.0,Cork,"Garnet red color with ruby ​​reflections. The nose is complex with hints of cherry, balsamic, and mineral notes. Fresh and fruity on the palate, with notes of licorice and a pleasantly bitter finish. Ready to drink, but with an excellent aging potential."" - Importer",1282
120203,Spain,Spain,Red,14.5,Cork,,1778
118353,South Australia,McLaren Vale,Red,14.5,Screwtop,"A consistently great McLaren Vale Shiraz. Generously rich with amazing fruit weight and balanced, chewy tanins. Brimming with ripe red fruits and an underlying layer of subtle oak, as well as a hint of pepper. This wine represents great value, and has a long life ahead of it... If you can resist! "" - Winery",1328
116592,Central Valley,Maule,Red,13.0,Cork,,1797
105456,California,California,Red,13.5,Cork,"Our Velvet is made up of grapes from some of the finest vineyards in California. This wine shows a heady nose of chocolate, deep rich blackberries, red fruits, and a creamy mocha finish that is unmistakable in its intensity and length. It's reminiscent of a blackberry chocolate cupcake with a mocha coulis. Enjoy with sweet and spicy Hoison steak, a barbeque bacon cheeseburger or even dark chocolate fondue.",1847
112623,Cava,Cava,White,11.5,Cork,"Fresh, bright and clean with white flowers and citrus lifting the slight bready quality. The fruit component really pops in this cuvée. Complex enough to keep you coming back for more but simple enough to drink with abandon."" - Importer",1144
113424,Apulia,Salice Salentino,Red,13.5,Cork,"Deep ruby red color. Intense fruity nose with aromas of blackberry and plum. In the mouth it is warm, velvety and well- balanced, with smooth integrated tannins."" - Importer",1514
114292,Roussillon,Roussillon,White,12.5,Cork,"White flowers (hawthorn & acacia), pear & peach followed by toasted, brioche & fresh butter aromas make a harmonious bouquet. Delicate, long-lasting bubbles.",1001
100259,Bordeaux,Haut Medoc,Red,13.5,Cork,"Belonging to the same owner as the Chateau Ramage La Batisse, Chateau Tourteran produces a very aromatic wine, vinified according to more traditional methods."" - Importer",1451
118720,Western Australia,Margaret River,White,13.5,Screwtop,,1646
119302,Coastal Region,Swartland,Red,,Cork,"This is a medium-bodied, blended red wine made for family and friends. These vineyards are all farmed organically."" - Importer",1703
54006,Champagne,Champagne,White,12.0,Cork,"Gold tints. Plenty of autolytic development, and the aroma of just-wrinkled, super-sweet golden delicious apples. Mouthfilling lacy mousse. Beautiful intensity. Slightly bitter seam around a heart of fresh crunchy fruit, spice and brioche. Full yet diaphanous. So much pleasure per sip. Drink from 2013-2016. VGV (TC)."" (04/13) - <b>17 out of 20 Points, Jancis Robinson's Purple Pages.</b><br/><br/>

<b>Wine</b>:<br/>

""The new release of the Ployez-Jacquemart non-vintage Brut is outstanding on both the nose and palate. The blend is made up of sixty percent pinot noir and pinot meunier, combined with forty percent chardonnay. The bouquet is deep, quite marked by its red grape components and beautifully complex, as it jumps from the glass in a blaze of ripe apple, blood orange, fresh-baked bread, caraway seed, citrus peel and a very complex base of minerality. On the palate the wine is deep, full-bodied and snappy, with a great core of fruit, bright acids, great focus, very fine mousse and exceptional grip on the very long, minerally and intensely flavored finish. There is a depth and flavor authority here that is most rare in Brut NVs, and as good as this wine is today, it will only get better if cellared for a few years. Superb bubbly. 2010-2030."" - <b>Importer</b>  <br/><br/>

<b>Producer</b>:<br/>

""Ployez-Jacquemart is recognized as being a top producer regularly by the Wine Spectator, Jancis Robinson, Revue de Vin de France, Peter Liem, View from the Cellar and the Wine Advocate. John Gilman offer that the wines of Ployez-Jacquemart are, ""one of the best-kept secrets in the realm of world class bubbly. The wines have never varied from their classic, complex and beautifully balanced style that emphasizes stunning purity of fruit, superb minerality, gentle leesy tones, very refined mousse and simply stunning complexity.""""<br/><br/>

""Laurence Ployez is a third-generation winemaker at her family's estate, which was established in 1930. Ployez-Jacquemart owns 2.15 hectares of Premier Cru and Grand Cru vineyards in Ludes and Mailly-Champagne in the Montagne de Reims, known for its classic chalk slopes. Laurence purchases Premier Cru and Grand Cru grapes from 12 hectares of vineyards from growers that the family has worked with for over 20 years. All of the work in the vineyards is done by hand, from the beginning of the growing season until the grapes are harvested. Only first press juice goes into the Ployez-Jacquemart wines. A light filtration is used for wines produced in vats, but no filtration is used on wines aged in wooden barrels. The wines undergo a very slow bottle fermentation in a 25 meter-deep cellar, giving them extremely fine bubbles. Wines are aged nose to punt, or sur pointe, in lieu of being aged on their side. Aging sur pointe provides the antioxidative and aging benefits of the lees while not allowing the wines to become too rich from the lees contact. When the wines are ready to be disgorged, after up to 12 years in the cellar, only a very minimal dosage is added, typically 3-4g/liter. Ployez-Jacquemart's goal is to leave the structure of each wine intact, allowing the true character and personality of the harvest to shine through. Unlike most producers in Champagne, she strives to keep the characteristic of each vintage even in her NV blends and only uses a very small amount of reserve wine, if any at all."" - <b>Importer</b>",1353
105895,Israel,Upper Gallilee,Red,15.2,Cork,"MEVUSHAL ""This wine is a blend of Shiraz, Petite Syrah and Petite Verdot. Each varietal involved in the wines was first aged for 8 month separately in French Oak Barrels. Once blended, the blend was then further aged for an additional 8 months in French Oak Barrels. TASTING NOTES: Deep red, dark and opaque color, black fruit aromas and a complex bouquet of cocoa, leather and mint with soft tones of spices. Its body is full, and its finish balanced and prolonged. Aging will further enhance its quality."" -- Importer",1580
117603,Burgundy,Bourgogne Blanc,White,13.0,Cork,"A very nice expressive nose has white flower scents. The attack is bold and generous. This wine, which is balanced on the palate, has good volume and quite exceptional long-lasting scents and tastes for this appellation. ",1996
120414,Niederosterreich-Lower Austria,Wagram,Red,12.5,Screwtop,"Bernhard Ecker farms 20 hectares in the serene Wagram, which separates Vienna from the Kamptal and Kremstal. This region has incredibly deep, and mineral rich loess soils, deposited by a receding primordial ocean, millions of years ago. The name Wagram comes from “Wogenrain” meaning “shore”. These deep soils are perfectly suited to  producing full bodied, rich and floral wines. Care is taken in the vineyards by pruning to limit yields. After a slow, cold fermentation wines are aged in stainless steel tanks. The resulting wines show an exceptional clarity and charm.
<br>
-- Importer",1095
